{
  "$schema": "https://json-schema.org/draft/2020-12/schema",
  "$id": "https://raw.githubusercontent.com/enricopiovesan/the-day-after-toolkit/main/schemas/extended-contract.schema.json",
  "title": "Extended Contract",
  "description": "Machine-readable schema for the extended capability contract described in the toolkit spec.",
  "type": "object",
  "additionalProperties": false,
  "required": [
    "id",
    "version",
    "owner",
    "state",
    "name",
    "description",
    "inputs",
    "outputs",
    "non_goals",
    "use_cases",
    "open_questions",
    "dependencies",
    "performance",
    "error_handling",
    "trust_zone",
    "rate_limits",
    "constraint_history",
    "version_history"
  ],
  "properties": {
    "id": {
      "type": "string",
      "description": "Semantic capability identifier in lowercase slash-delimited form such as payment/retry or auth/session/login.",
      "pattern": "^[a-z0-9]+(?:/[a-z0-9]+)+$"
    },
    "version": {
      "type": "string",
      "description": "Semantic version number for the contract using MAJOR.MINOR.PATCH.",
      "pattern": "^\\d+\\.\\d+\\.\\d+$"
    },
    "owner": {
      "type": "string",
      "description": "The team or individual accountable for maintaining this contract.",
      "minLength": 1
    },
    "state": {
      "type": "string",
      "description": "Lifecycle state for the contract.",
      "enum": ["draft", "active", "deprecated", "retired"]
    },
    "name": {
      "type": "string",
      "description": "Human-readable name for the capability.",
      "minLength": 1
    },
    "description": {
      "type": "string",
      "description": "Business intent for the capability: what it does and why it exists.",
      "minLength": 1
    },
    "inputs": {
      "type": "array",
      "description": "Declared inputs that the capability accepts, along with their business constraints.",
      "minItems": 0,
      "items": {
        "$ref": "#/$defs/input"
      }
    },
    "outputs": {
      "type": "array",
      "description": "Declared outputs that the capability returns, along with the guarantees each output provides.",
      "minItems": 0,
      "items": {
        "$ref": "#/$defs/output"
      }
    },
    "non_goals": {
      "type": "array",
      "description": "Explicit statements of what the capability does not do.",
      "minItems": 0,
      "items": {
        "$ref": "#/$defs/nonGoal"
      }
    },
    "use_cases": {
      "type": "array",
      "description": "Business intents or practitioner scenarios that this capability satisfies.",
      "minItems": 0,
      "items": {
        "$ref": "#/$defs/useCase"
      }
    },
    "open_questions": {
      "type": "array",
      "description": "Unresolved decisions that must be closed before the contract can be treated as authoritative.",
      "minItems": 0,
      "items": {
        "$ref": "#/$defs/openQuestion"
      }
    },
    "dependencies": {
      "type": "array",
      "description": "Capabilities that this capability depends on and the rationale for each dependency.",
      "minItems": 0,
      "items": {
        "$ref": "#/$defs/dependency"
      }
    },
    "performance": {
      "$ref": "#/$defs/performance"
    },
    "error_handling": {
      "type": "array",
      "description": "Declared error conditions and the required response for each.",
      "minItems": 0,
      "items": {
        "$ref": "#/$defs/errorHandlingEntry"
      }
    },
    "trust_zone": {
      "type": "string",
      "description": "Boundary classification for callers of the capability.",
      "enum": ["internal", "external", "privileged"]
    },
    "rate_limits": {
      "$ref": "#/$defs/rateLimits"
    },
    "inherited_constraints": {
      "type": "array",
      "description": "Constraints inherited from company, organization, or project level decisions.",
      "minItems": 0,
      "items": {
        "$ref": "#/$defs/inheritedConstraint"
      }
    },
    "constraint_history": {
      "type": "array",
      "description": "Historical notes capturing what was tried, what failed, and the lesson that must survive.",
      "minItems": 0,
      "items": {
        "$ref": "#/$defs/constraintHistoryEntry"
      }
    },
    "deprecation_timeline": {
      "type": ["string", "null"],
      "description": "ISO date for planned deprecation, or null if no deprecation is planned.",
      "format": "date"
    },
    "migration_path": {
      "type": ["string", "null"],
      "description": "What dependents must do if this contract is deprecated.",
      "minLength": 0
    },
    "versioning_strategy": {
      "type": "string",
      "description": "How this capability handles breaking, backward-compatible, and corrective changes.",
      "minLength": 1
    },
    "version_history": {
      "type": "array",
      "description": "Record of major contract versions and what changed in each one.",
      "minItems": 0,
      "items": {
        "$ref": "#/$defs/versionHistoryEntry"
      }
    }
  },
  "allOf": [
    {
      "if": {
        "properties": {
          "state": {
            "const": "deprecated"
          }
        },
        "required": ["state"]
      },
      "then": {
        "required": ["migration_path"],
        "properties": {
          "migration_path": {
            "type": "string",
            "minLength": 1
          }
        }
      }
    }
  ],
  "$defs": {
    "input": {
      "type": "object",
      "additionalProperties": false,
      "required": ["name", "type", "required", "constraints"],
      "properties": {
        "name": {
          "type": "string",
          "description": "Input field name used by the capability.",
          "minLength": 1
        },
        "type": {
          "type": "string",
          "description": "Declared JSON-compatible type for the input.",
          "enum": ["string", "number", "boolean", "object", "array"]
        },
        "required": {
          "type": "boolean",
          "description": "Whether this input must be provided by callers."
        },
        "constraints": {
          "type": "string",
          "description": "Business constraint on this input and why that constraint exists.",
          "minLength": 1
        }
      }
    },
    "output": {
      "type": "object",
      "additionalProperties": false,
      "required": ["name", "type", "guarantees"],
      "properties": {
        "name": {
          "type": "string",
          "description": "Output field name produced by the capability.",
          "minLength": 1
        },
        "type": {
          "type": "string",
          "description": "Declared JSON-compatible type for the output.",
          "enum": ["string", "number", "boolean", "object", "array"]
        },
        "guarantees": {
          "type": "string",
          "description": "Guarantee this capability makes about the output value.",
          "minLength": 1
        }
      }
    },
    "nonGoal": {
      "type": "string",
      "description": "Single-sentence statement of what the capability explicitly does not do.",
      "minLength": 1
    },
    "useCase": {
      "type": "string",
      "description": "A practitioner-facing scenario that this capability serves.",
      "minLength": 1
    },
    "openQuestion": {
      "type": "string",
      "description": "A question that still needs resolution before the contract can be authoritative.",
      "minLength": 1
    },
    "dependency": {
      "type": "object",
      "additionalProperties": false,
      "required": ["id", "version", "rationale"],
      "properties": {
        "id": {
          "type": "string",
          "description": "Capability identifier for the dependency.",
          "pattern": "^[a-z0-9]+(?:/[a-z0-9]+)+$"
        },
        "version": {
          "type": "string",
          "description": "Version constraint that this capability requires from the dependency.",
          "minLength": 1
        },
        "rationale": {
          "type": "string",
          "description": "Why this capability depends on this dependency in this specific way.",
          "minLength": 1
        }
      }
    },
    "performance": {
      "type": "object",
      "additionalProperties": false,
      "required": ["response_time_p99_ms", "throughput_rps", "notes"],
      "properties": {
        "response_time_p99_ms": {
          "type": "integer",
          "description": "Ninety-ninth percentile response time threshold in milliseconds.",
          "minimum": 0
        },
        "throughput_rps": {
          "type": "integer",
          "description": "Sustained throughput target in requests per second.",
          "minimum": 0
        },
        "notes": {
          "type": "string",
          "description": "Context needed to interpret the performance thresholds.",
          "minLength": 1
        }
      }
    },
    "errorHandlingEntry": {
      "type": "object",
      "additionalProperties": false,
      "required": ["error", "required_response"],
      "properties": {
        "error": {
          "type": "string",
          "description": "Declared error condition name.",
          "minLength": 1
        },
        "required_response": {
          "type": "string",
          "description": "Required behavior when the error occurs.",
          "minLength": 1
        }
      }
    },
    "rateLimits": {
      "type": "object",
      "additionalProperties": false,
      "required": ["requests_per_minute", "burst_allowance", "notes"],
      "properties": {
        "requests_per_minute": {
          "type": "integer",
          "description": "Allowed steady-state request rate per minute.",
          "minimum": 0
        },
        "burst_allowance": {
          "type": "integer",
          "description": "Permitted short burst above the steady-state limit.",
          "minimum": 0
        },
        "notes": {
          "type": "string",
          "description": "Context for the rate limit values.",
          "minLength": 1
        }
      }
    },
    "inheritedConstraint": {
      "type": "object",
      "additionalProperties": false,
      "required": ["source", "constraint"],
      "properties": {
        "source": {
          "type": "string",
          "description": "Where the inherited constraint comes from.",
          "enum": ["company", "org", "project"]
        },
        "constraint": {
          "type": "string",
          "description": "The inherited constraint stated precisely.",
          "minLength": 1
        }
      }
    },
    "constraintHistoryEntry": {
      "type": "object",
      "additionalProperties": false,
      "required": ["date", "context", "outcome", "lesson"],
      "properties": {
        "date": {
          "type": "string",
          "description": "Date of the prior attempt or incident.",
          "format": "date"
        },
        "context": {
          "type": "string",
          "description": "What was tried or what situation led to the lesson.",
          "minLength": 1
        },
        "outcome": {
          "type": "string",
          "description": "What happened as a result of the attempt.",
          "minLength": 1
        },
        "lesson": {
          "type": "string",
          "description": "What future maintainers must remember from the history.",
          "minLength": 1
        }
      }
    },
    "versionHistoryEntry": {
      "type": "object",
      "additionalProperties": false,
      "required": ["version", "date", "changed"],
      "properties": {
        "version": {
          "type": "string",
          "description": "Contract version that the history entry describes.",
          "pattern": "^\\d+\\.\\d+\\.\\d+$"
        },
        "date": {
          "type": "string",
          "description": "Date the version was introduced.",
          "format": "date"
        },
        "changed": {
          "type": "string",
          "description": "What changed and why it changed.",
          "minLength": 1
        }
      }
    }
  }
}
