{
  "id": "payment/retry/extended",
  "version": "1.2.0",
  "owner": "Payments",
  "state": "active",
  "name": "Payment Retry",
  "description": "Keep the customer payment flow moving when an upstream authorization fails.",
  "inputs": [],
  "outputs": [],
  "non_goals": [],
  "use_cases": [],
  "open_questions": [],
  "dependencies": [],
  "performance": {
    "response_time_p99_ms": 200,
    "throughput_rps": 50,
    "notes": "Handles online checkout requests only."
  },
  "error_handling": [],
  "trust_zone": "internal",
  "rate_limits": {
    "requests_per_minute": 60,
    "burst_allowance": 10,
    "notes": "Applies only to public API calls."
  },
  "constraint_history": [],
  "version_history": [
    {
      "version": "1.0.0",
      "date": "2026-01-01",
      "changed": "Initial release."
    }
  ]
}
